course_title,course_code,university,country,source_url,academic_year,semester,semester_normalized,study_level,credits,credit_system,ects_credits,aims,course_content,learning_outcomes,assessment_methods,literature
Applications of Finance,BUST08018,University of Edinburgh,United Kingdom,https://www.drps.ed.ac.uk/25-26/dpt/cxbust08018.htm,2025/26,Semester 2,summer,Undergraduate,20,SCQF credits,10.0,"The course will consolidate the conceptual learning in Principles of Finance by introducing students to some of the practical aspects of finance, for example valuation, company risk management and company restructuring.","The course is designed to complement Principles of Finance. The latter is a theoretical and conceptual course which introduces students to the core ideas of finance. Applications of Finance will fill focus on empirical and practical applications of these concepts and theories. Thus, the course will consolidate the conceptual learning in Principles of Finance by introducing students to some of the practical aspects of finance, for example, valuation, trading strategies based on derivatives, and new finance applications, such as blockchain and high-frequency trading. Outline Content - Financial systems and the investment environment; - Trading, including high-frequency trading; - Currency markets and futures; - Interest rate and currency swaps; - Options and trading strategies; - Socially responsible investing, corporate governance and corporate social responsibility; - Financial crises and investment management. - Blockchain and cryptocurrencies. Student Learning Experience Broadening knowledge of core concepts and ideas in finance, in particular in the areas of investment management, and risk management with derivatives; introduction to empirical research in finance; Further knowledge of financial instruments, markets and transactions; for example, options, forwards/futures, and cryptocurrencies; further knowledge of financial information used by company executives, investors and analysts.","On completion of this course, the student will be able to: Broaden their knowledge and understanding of core concepts and ideas in finance, such as investment management and risk management with derivatives. Undertake a literature review by critically evaluating academic papers in the finance literature. Understand and critically discuss important traditional and new applications of finance, such as forward and futures, options, blockchain and high-frequency trading. Understand and critically discuss the financial information used by company executives, investors and analysts.","Written Exam 70 %, Coursework 30 %, Practical Exam 0 %","This course builds heavily on academic research papers. Therefore, there is no textbook which is recommended that students buy. Instead, students are advised to do the reading as listed under each topic. Additional resources may be added where appropriate, for example where topical readings are published during the semester. Any such material will be highlighted at the start of each lecture. Students may find the following textbooks useful for general background reading (any edition will be suitable) Keith Pilbeam, Finance & Financial Markets, Palgrave Macmillan. Bodie, Kane and Marcus (2010), Investments, McGraw Hill. Maginn, Tuttle, Pinto, and McLeavey (2007) Managing Investment Portfolios: A Dynamic Process, published by CFA Institute and Wiley. Reading financial press and blogs is essential to get the most out of this course."
Business Analytics and Information Systems,BUST08032,University of Edinburgh,United Kingdom,https://www.drps.ed.ac.uk/25-26/dpt/cxbust08032.htm,2025/26,Semester 2,summer,Undergraduate,20,SCQF credits,10.0,This course demonstrates how information systems and decision support tools can be effectively integrated to analyse and solve business problems.,"This course discusses how business analytics and information system tools can be used in synergy to address a variety of business problems. As for the information system part, the emphasis is placed on 1. the illustration of how data can be modelled, stored and retrieved, 2. the application of data management tools to tackle business problems. The focus of business analytics is on: 1. the introduction of a range of prescriptive analytics tools which has been shown to aid decision-making in practice, 2. the utilisation of software with appropriate data to formulate and execute various models, 3. the explanation of the findings from modelling a managerial situation to the relevant stakeholders. Outline Content L 1. Data Management and Database Design L 2. Entity-relationship L 3. Structured Query Language L 4. Introduction to Linear Programming L 5. Sensitivity Analysis and Advanced Applications in Linear Programming L 6. Group Project Proposal Presentation L 7. Introduction to Decision Analysis L 8. Decision Analysis with Experiment L 9. Data Visualization L 10. Guest Speakers and revision Student Learning Experience The course is taught by means of lectures, computer labs, tutorials, and group activities. Lectures cover topics in information systems and data management, such as database design and SQL; as well as a number of business analytics techniques, such as linear programming, decision analysis and data visualisation. Computer labs let students acquire the skills that are necessary to apply these techniques in practice by using state of the art software packages. Tutorials provide an understanding of the theory underpinning the aforementioned techniques. Group activities are designed to let students experience challenges and opportunities that stem from the integration of decision support models and information systems.","On completion of this course, the student will be able to: Apply database design principles and the Structured Query Language to model, store, and retrieve data in database management systems. Transform a verbal business statement into its equivalent mathematical model. Demonstrate a sound knowledge of linear programming and sensitivity analysis. Demonstrate a good knowledge of decision analysis for business problems with uncertainty. Utilise modelling software and solver to formulate business problems and to identify their optimal solutions.","Written Exam 40 %, Coursework 30 %, Practical Exam 30 %","James R. Evans, Business Analytics. Pearson (2nd international edition). 2016 ISBN-13: 978-1292095448 Wayne L. Winston, Operations Research Applications and Algorithms (4th ed.), Brooks/Cole Publishing 1998, ISBN 0534423620 David R. Anderson, Dennis J. Sweeney, Thomas A. Williams, R. Kipp Martin, An Introduction to Management Science: Quantitative Approaches to Decision Making (12th international ed), Cencage 2013, ISBN 978-1-133-58446-9. (Note that other editions of this text have similar content.) Thomas Connolly, Carolyn Begg, Database Systems: A Practical Approach to Design, Implementation and Management, Global Edition, 6th Edition, Pearson, 2015. Frederick S. Hillier and Gerald J. Lieberman, Introduction to Operations Research (7th ed.), McGraw-Hill, 2009, ISBN 0071324836"
Business Economics,BUST08005,University of Edinburgh,United Kingdom,https://www.drps.ed.ac.uk/25-26/dpt/cxbust08005.htm,2025/26,Semester 1,winter,Undergraduate,20,SCQF credits,10.0,This course gives students an understanding of economic principles which enable managers to make optimal decisions and also makes students aware of some government policies which affect the decisions managers can make. The course encourages students to develop a critical and evaluative approach to the principles they are taught.,"The course is divided into topics. Firstly we consider the objectives of owners and managers. Secondly we consider demand and forecasting followed by cost theory and measurement. Then we put these two topics together and consider pricing policy with a particular interest in the interactions between firms. Next we consider pricing and other behaviour which is constrained by government competition policy. We then turn to another managerial policy: advertising decisions and then consider a very common problem: markets where the buyer or seller has different information compared with the other. Finally we look at the implications of being part of a network (e.g. a mobile telephone network). Outline Content 1. Demand Analysis and Estimation 2. Productivity and Efficiency Analysis 3. Market Structure, Conduct and Performance 4. Pricing with Market Power 5. Introduction to Game Theory 6. Oligopoly 7. Asymmetric Information 8. Network Economies Student Learning Experience The lectures will outline the economic principles with case examples. The tutorials will give students the opportunity to apply the principles to particular cases. The coursework essay will give students the opportunity either to apply economic principles to a particular case or to businesses in general.","On completion of this course, the student will be able to: Apply economic concepts for the quantitative analysis of demand, pricing, productivity or efficiency as well as the qualitative understanding of market structure and its implications on firm performance. Formalise and solve decision-making problems related to profit or value maximization in competitive contexts, as well as achieve a qualitative understanding of how network effects and asymmetric information affect market outcomes and business decision-making.","Written Exam 0 %, Coursework 100 %, Practical Exam 0 %","Recommended to buy: M R Baye Managerial Economics and Business Strategy, McGraw Hill, 7th ed., 2010. Additional reading: H. Davies & P. L. Lam Managerial Economics, 3rd ed. Prentice Hall, 2001. I Png & D Lehman, Managerial Economics, 3rd ed., Blackwell, 2007, would be useful. Other suggested reading: W D Reekie & J N Crook, Managerial Economics, 4th ed., Prentice Hall, 1994. D Besanko, D Dranove, S Schaefer and M Shanley, Economics of Strategy, John Wiley and Sons, 6th ed., 2013. T. Jones Business Economics and Managerial Decision Making, John Wiley & Sons, 2004. J Buckley, C Smith & J Zimmerman, Managerial Economics and Organizational Architecture, McGraw-Hill, 5th International Edition, 2009 P G Keat & P Young Managerial Economics, Pearson, 2009. M Moschandreas, Business Economics, Business Press, 2000. G.A. Petrochilos Managerial Economics, Palgrave, 2004"
Business Research Methods 2: Research Design and Application,BUST08056,University of Edinburgh,United Kingdom,https://www.drps.ed.ac.uk/25-26/dpt/cxbust08056.htm,2025/26,Semester 2,summer,Undergraduate,20,SCQF credits,10.0,"Business research has been defined as the systematic gathering, recording and analysing of data about problems relating to businesses. This course, which follows on from Business Research Methods I, introduces further aspects of business research and demonstrates the fundamental role and importance it plays in making of appropriate business decisions. It provides an understanding of the philosophical building blocks of research design, outlines both qualitative and quantitative techniques for data collection and analysis and gives students the chance to collect and analyse data for themselves.","This course is core to the undergraduate programmes in Business Studies single honours and combined degrees, and International Business degrees. The course is designed to fill a gap in the application and analysis of core business research skills, building on key skills acquired in Business Research Methods I. Lectures present critical overviews of key concepts, processes and debates within the subject, relating theories to a wide range of current examples. Outline content - Introduction: Overview of the research process and Academic Research - Research approaches and philosophies & How to conduct a literature review - Qualitative Methodologies & Qualitative Methods of Data Collection - Interviewing - Focus groups - Secondary & Documentary data - Ethnography & Netnography - Qualitative Analysis & Interpretation - Basics of Quantitative Research: Measurement scales, questionnaire design, & sampling - Further considerations of Quantitative Research: Sampling, response rate, & reliability and validity - Different Types of Quantitative Research: Survey & Experiment - Approaches to Quantitative Data Analysis: Preparing the data and choosing appropriate statistical tests","On completion of this course, the student will be able to: Understand the nature and scope of business research, its process, and its philosophical foundations. Define research problems and formulate research questions grounded in relevant literature on a selected topic. Apply their understanding of the stages of the research process and adapt them to a specific research context. Demonstrate an appreciation of various research approaches and research methods (qualitative and quantitative) along with an awareness of both their contribution and limitations. Analyse the data using appropriate methods and tools.","Written Exam 0 %, Coursework 100 %, Practical Exam 0 %","Core text Bell, Harley & Bryman (2022). Business Research Methods (6th edition)"
Business Research Methods I: Introduction to Data Analysis,BUST08033,University of Edinburgh,United Kingdom,https://www.drps.ed.ac.uk/25-26/dpt/cxbust08033.htm,2025/26,Semester 1,winter,Undergraduate,20,SCQF credits,10.0,In modern management it is important to be numerate. The objective of this course is to give the student an appreciation and an ability to employ Quantitative Techniques used in Business and Management Research.,"All Business Management students require the ability to deal with quantitative material, including the collection, collation and analysis of such data. This course introduces students to the quantitative techniques in business mainly centred on statistical aspects. It also provides them with experience in designing questionnaires and report writing. Guidance will be given using Excel and SPSS. Syllabus - Types and Sources of Data - Samples and Surveys - Exploratory Data Analysis - Probability, Estimation and Sampling Distributions - Hypothesis Testing - Non-Parametric Hypothesis Testing - Correlation - Regression Student Learning Experience The course is delivered through lectures, problem-solving sessions, discussion boards and self-experiential learning. The lectures provide the concepts of the techniques for collection, presentation and analysis of data. The tutorials reinforce the use of the techniques through examples and discussion. The student will gain valuable further understanding and experience through reading the appropriate sections in the suggestion text and through the coursework.","On completion of this course, the student will be able to: Describe basic statistical techniques for data collection, presentation and analysis. Critically review the collection, presentation and analysis of data. Understand and explain how to tackle business problems through the use of statistical techniques. Apply statistical techniques to data. Discuss the results of the application of statistical techniques to data in written reports and oral presentation.","Written Exam 60 %, Coursework 40 %, Practical Exam 0 %",The core text for this course is OpenIntro Statistics 4e: https://www.openintro.org/book/os/. Course URL http://www.bus.ed.ac.uk/programmes/ugpc.html
Business Simulation,BUST08031,University of Edinburgh,United Kingdom,https://www.drps.ed.ac.uk/25-26/dpt/cxbust08031.htm,2025/26,Semester 2,summer,Undergraduate,20,SCQF credits,10.0,"Business Simulation is a practical, integrative business course that requires teams of students to operate a simulated start-up business. Acting as a board of directors, students set the direction for the company to build up the business by making decisions related to its strategy, finance, market, operations, staffing and innovation. It aims to foster interdisciplinary decision-making in an inexact environment and to prepare students for the problems and issues of working in a changing and uncertain world. This course has a quota of 120 students.","Business Simulation is built around a computer-based business simulation of a technology company start-up. Students on the course are formed into company teams of six or so members who will self-allocate themselves into the different board of director roles (Strategy, Finance, Marketing, Operations, HR/Organisation and Innovation) to manage their simulated company through a series of five simulation rounds that represent two years in the life of the company. The purpose of the course is to provide an experiential learning environment where the connectivity of the different functions within a business is made explicit. Students will have the opportunity to apply their learning from the earlier elements of their degree programme to the problems presented by the simulation; and are required to develop the business, justifying and reporting the decisions they make for their simulated firm. Students will also learn via taught classes each week. These will cover (in the order indicated below) the various business functions that relate to running a business, focusing initially on lessons drawn from the simulated environment then introducing guest lectures where a practitioner will present a talk about their business experience. This provides a link between the theoretical and practical nature of business management and background and context for the various company groups in managing their business start-ups. Syllabus: L1: Introduction L2: The aims, structure and function of a business L3: Planning for a start-up business L4: Organising a small business L5: Effective team working L6: Guest Speaker: Case Example - Organising a small business. L7: Market analysis L8: Marketing and sales strategy L9: Operations management L10: Guest speaker: Case Example - Operations in a Small Business Innovative Learning Week Non-teaching week L11: Measuring business performance L12: Guest speaker: Case Example - Financing a Small Business L13: Finance options for business expansion L14: Guest Speaker: Contemporary issues in new venture finance L15: Innovation L16: Guest speaker: Case Example: Disruptive Innovation L17: Leadership in the context of small business L18: Guest speaker: Leading Successful New Ventures L19: Debrief and lessons L20: Guest Speaker: Growth Strategies and Crossing the Chasm Student Learning Experience As a course, Business Simulation is built around a computer-generated business start-up simulation. Students are formed into groups of six to be the managers of a business start-up where they have to make the necessary strategic, marketing, financial, operational and organisational decisions for their start-up and throughout the course of the simulation which over the duration of the course will represent two years of the business' operations. Group interactions allow students to learn about the issues surrounding teamwork, effective leadership and the development of social skills within organisations.","On completion of this course, the student will be able to: Understand different perspectives on business decisions and develop intuition, judgement and be able to undertake critical analysis in a dynamic, uncertain and complex environment. Evaluate data and information, determine its relevance and validity and apply this to develop an understanding of the simulated business environment and to guide their strategic decision making and creative thinking. Demonstrate an ability to apply general management know-how as a member of a team in a simulated business setting. Understand and be able to exercise managerial responsibility and work effectively as a team in an organizational setting, including issues of leadership and motivation. Understand the interrelationship and interdependence of the separate functional aspects of business management in a holistic/real world context, including conveying complex information to a range of audiences.","Written Exam 0 %, Coursework 100 %, Practical Exam 0 %","The course is based around a computer-based business simulation, which students access via a browser and which provides information and reports on the development and condition of the simulated business. This computer-based tool provides the simulated economic and business environment, keeps records of all group actions and provides data and information that students can use to make decisions within the simulated business environment. The simulation environment also includes a bespoke collection of chapters containing academic research on the management of business to help link the practical nature of the course and the practical experience of the guest speakers to tools of management that have been developed in wider business contexts. These chapters form a text for the course that is retained by each student on completion."
