course_title,course_code,university,country,source_url,academic_year,semester,semester_normalized,study_level,credits,credit_system,ects_credits,aims,course_content,learning_outcomes,assessment_methods,literature
Managing Employment Law,BUST10028,University of Edinburgh,United Kingdom,https://www.drps.ed.ac.uk/25-26/dpt/cxbust10028.htm,2025/26,Semester 2,summer,Undergraduate,20,SCQF credits,10.0,"The role of the law within the employment relationship has become increasingly prominent in recent years, and the development of labour legislation has proceeded apace. The complexities of the legal issues arising from employment are considerable. It has become increasingly important that all organisational stakeholders such as managers, employees and trade unions, are familiar with the complex range of legal rights and obligations that surround the employment relationship. Understanding the management of employment law is of considerable academic and practical relevance to students of management and organisation studies.","While we start from the assumption that recourse to the institutions of the law is a last resort for organisational actors, an understanding of the parameters and principles emanating from those institutions is crucial to successful organisational functioning. This course will encourage students to think critically about the way in which the law both constrains and facilitates relationships between parties within work organisations, and its relationship to effective organisational functioning. The course covers the following areas: the institutions of employment law; the contract of employment; implied rights and duties in the employment relationship; equality law; contractual variation, contractual breach and unfair dismissal. Thus, the course will cover both the role of the common law in employer-employee relations, the existing (and expanding) statutory framework; the way in which relative standards of behaviour (for example, reasonableness or fairness) are interpreted and acted upon by tribunals and participants in organisations; critiques of law and practice in this area; how employers, employees and their representatives have positioned themselves in relation to existing and proposed developments in employment law; and the role of the law in contributing positively to the management of purposeful organisations. Outline Content - The framework of employment law: sources, institutions and context - The contract of employment: terms and conditions of employment, employment status and continuity of employment - Workplace disputes and termination of employment by dismissal - Redundancy & TUPE - Pay & working time - Privacy and confidentiality in the workplace - Discrimination 1: protected characteristics and prohibited conduct - Discrimination 2: discrimination in the employment context - Parental rights and work/life balance - Collective rights: trade unions & information and consultation Student Learning Experience The course comprises a mixture of formal lectures and group discussions. The lecture programme will provide an overview of key issues, supported by a range of suggested readings. Group discussions will focus upon understanding of the legal framework and its implications for organisational stakeholders, and on applying the legal framework to the problems confronting managers and employees in organisations. Depending on student numbers, students may be given individual responsibility for analysing a particular case or issue, or applying their minds to hypothetical problems. Students will be expected to participate in class discussions. Questions for discussion will be distributed one week before each lecture and students may be asked to prepare a response to discuss at the lecture. The course project will allow students to apply a wider range of existing material to a more narrowly defined topic in an organisational context in order to encourage the development of stronger evaluative, rather than descriptive, skills.","On completion of this course, the student will be able to: Understand and discuss the institutions and law-making processes relevant to the management of employees. Understand and critically discuss the essential nature and terms of the employment contract. Understand and critically discuss the roles, rights and responsibilities of all parties to the employment relationship. Identify and discuss underlying principles and objectives in legal regulation of the employment relationship. Critically evaluate current employment regulation in light of historical developments.","Written Exam 70 %, Coursework 30 %, Practical Exam 0 %","Students will require to consult an up to date text book on employment law. The recommended text is: - Stephen Taylor and Astra Emir (2019) (5th Edition), Employment law: an introduction, Oxford University Press, Oxford. This text is designed for students of business and management and covers all topics considered on this course. For further detail on topics of particular interest you may wish to consult other relevant texts available in the law library, such as: Cabrelli, D., Employment Law in Context, 3rd edn (2018) Oxford University Press Pitt, G., Employment Law (10th Edition) (2016) Sweet and Maxwell In addition to the normal requirements of academic study, students will be expected to keep up-to-date with developments in the area through newspaper and journal reports. Relevant Journals There are a number of relevant journals in this area including: - W. Green, Employment Law Bulletin (available in electronic form through Westlaw database) - Industrial Law Journal (available in electronic form) - IDS Brief: Employment Law and Practice - British Journal of Industrial Relations (available in electronic form) - Industrial Relations Journal (available in electronic form) Most of the journal articles referred to in the course booklet are available through the Westlaw database. Relevant Websites - www.acas.org.uk - www.bis.gov.uk - www.cipd.co.uk - www.equalityhumanrights.com - www.cbi.org.uk - http://www.direct.gov.uk/en/Employment/Employees/index.htm - www.tuc.org.uk"
Managing in the third sector,BUST10166,University of Edinburgh,United Kingdom,https://www.drps.ed.ac.uk/25-26/dpt/cxbust10166.htm,2025/26,Semester 2,summer,Undergraduate,20,SCQF credits,10.0,"The third sector (social enterprises, voluntary organisations, charities, NGOs etc.) is a key component of societies and economies globally. This course will enable students to (1) understand its key elements and potential (2) examine the significant challenges of managing and leading the sector, (3) evaluate and analyse its role in stimulating active citizenship, and (4) visualise and propose innovative third sector solutions to social/environmental problems, in a range of settings including developing economies and the global south. Key topics will include: -Understanding the third sector -The third sector and public services -Collaboration between state, business and the third sector -The impact of digital and AI technology on the sector -Social impact and innovation in the third sector -The critique and 'dark side' of the third sector -The third sector in developing economies and global south Students will incorporate their past learning in management to their understanding of third sector, considering this in a global context. The course will also draw upon social policy, international development and public policy, and will be of interest to students from across the university. This course will enhance students' employability skills by embracing intellectual, analytical, critical knowledge of managing the third sector but also visualising and developing innovative third sector solutions to global grand challenges.","The course will draw on research knowledge about the third sector from a range of management disciplines, including strategy, organisational studies, service management marketing and innovation. It will also integrate these with knowledge from other disciplines including social policy, international development and public policy. Integrating theories from service management and public administration and management, the course will challenge students to explore the hybridity of third sector organisations and its implications for their management, how they balance social and business imperatives and the balance between the positive and the 'dark side' of third sector organisations. The third sector exists at the nexus of the public and private sectors, and is a significant source of employment for many students. The course will be delivered through lectures and associated seminars on the analysis of international real-life cases. Some lectures will be delivered by guest speakers from practice. Students will be expected to contribute to seminar discussions and group activities as well as to engage fully with guest speakers from practice. In the assessments, student will be expected to link their learning with these real-life management challenges, making explicit the links and proposing ideas for establishing third-sector organisations.","On completion of this course, the student will be able to: Consider and analyse the core principles and values that underpin the practice of managing third sector organisations. Understand management challenges in the third sector through the lens of service theory and public management theories. Synthesise cross-disciplinary theories and concepts in order to critically evaluate management approaches in third sector organisations. Demonstrate the capacity to innovate and communicate third-sector approaches to a range of stakeholders.","Written Exam 0 %, Coursework 100 %, Practical Exam 0 %","J Rees & D Mullins (2016) The third sector delivering public services (Bristol University Press) M Kallman & T Clark (2016) The Third Sector (University of Illinois Press) M Hudson (2017) Managing without Profit (Directory of Social Change) L Portales (2020) Social Innovation and Social Entrepreneurship (Palgrave Macmillan) M Roy & J Farmer (2021) Social Enterprise, Health, and Wellbeing: Theory, Methods, and Practice (Routledge) Gronroos, C. (2016) Service Management and Marketing (4th ed.) (Wiley)"
Marketing and Society,BUST10108,University of Edinburgh,United Kingdom,https://www.drps.ed.ac.uk/25-26/dpt/cxbust10108.htm,2025/26,Semester 1,winter,Undergraduate,20,SCQF credits,10.0,"This course introduces students to a variety of applications of nonprofit marketing. It will consider how commercial marketing concepts can be applied to nonprofit organisations, in contexts such as social marketing and behaviour change, charities marketing and fundraising, and political marketing. The course also considers the dark side of marketing through an examination of issues such as bad marketing practices, advertising stereotypes, commercialisation of life, technology society and McDonaldisation. By the end of the course, students should be engendered with a critical understanding of the applications of marketing and have an appreciation of marketers' responsibilities to organisations and to society.",Outline Content - Introduction to nonprofit marketing - Social marketing - Charities marketing - Political marketing - Dark side of marketing: bad marketing practices - Advertising stereotypes - Commercialisation of life - Technology society - McDonaldisation,"On completion of this course, the student will be able to: Understand, critically examine, and discuss a range of conceptual and practical issues related to marketing and society. Apply marketing concepts, theories and frameworks to a variety of marketing and consumption contexts. Demonstrate critical thinking and analysis of the positive and negative contributions of marketing to society.","Written Exam 0 %, Coursework 100 %, Practical Exam 0 %","A resource list will be published in Week 1. Please note that there is no textbook for this course - readings will be taken from academic journals, case studies, organisation reports and websites, as well as marketing-related magazines and blogs."
Mathematical Programming in Advanced Analytics,BUST10134,University of Edinburgh,United Kingdom,https://www.drps.ed.ac.uk/25-26/dpt/cxbust10134.htm,2025/26,Semester 2,summer,Undergraduate,20,SCQF credits,10.0,"This course will provide students with the foundations of prescriptive analytics with emphasis on mathematical programming concepts, applications, models, and solution methods.","Optimisation problems are concerned with optimising an objective function subject to a set of constraints. When optimisation problems are translated in algebraic form, we refer to them as mathematical programs. Mathematical programming, as an area within Operational Research (OR), Management Science (MS) and Business Analytics (BA), is concerned with model building and strategies and methods for solving mathematical programs. In this course, we address model building in OR/MS/BA, present a variety of typical OR/MS/BA problems and their mathematical programming formulations, provide general tips on how to model managerial situations, and discuss solution strategies for a class of deterministic and/or under uncertainty problems. Last, but not least, students will learn how to use/build prescriptive analytics tools in the context of decision problems faced by business managers. The four main topics covered in this course are: Outline Conent 1. Introduction to OR/MS and Model Building; 2. Linear Programming (LP): Review of basic concepts and methods; namely, the simplex method and the dual simplex method, sensitivity analysis, and duality theory; 3. Integer Programming (IP): Basic concepts, relationship with linear programming, strategies and methods of solving integer programs; namely, brand-and-bound algorithms, cutting plane algorithms, and brand-and-cut algorithms; 4. Optimisation under Uncertainty: Basic concepts in two-stage stochastic programming and robust optimisation, relationship with deterministic equivalent formulations, and applications. Student Learning Experiences This lecture and tutorial programme, which builds on knowledge from Management Science & Business Analytics courses in earlier years, develops mathematical programming model building and solution techniques, and is supported by mandatory readings and supervised discussion sessions. These supervised sessions aim at discussing how to put into practice the concepts and methods presented in the lectures and learned from the mandatory readings and the term projects. In addition, these sessions also serve as advice/support sessions so that students can seek feedback on their term projects work-in-progress. The student experience requires active learning and engagement, which requires students to read relevant chapters in the textbooks and other sources before attending classes. Students are required to complete three group projects using GAMS. Besides attending lectures and supervised discussion sessions (both of which are compulsory), students will work in groups on realistic projects (groups will be formed by the lecturer to reflect a heterogeneity of skills required for the projects) and present their work in class to an audience that may include practitioners and term project providers. Guest speakers might be invited for the benefit of students, however, students should not expect any hand-outs from the guests.","On completion of this course, the student will be able to: Assess critically the utility of a number of mathematical programming techniques. Describe mathematical programming solution strategies and techniques. Use mathematical programming methods to address management decision problems.","Written Exam 0 %, Coursework 90 %, Practical Exam 10 %","Recommended Reading: 1. S. P. Bradley, A. C. Hax, and T. L. Magnanti (1977), Applied Mathematical Programming, Addison-Wesley. [JCM Library shelfmark QA402.5 Bra; 2. Williams, H. P. (2013). Model building in mathematical programming. John Wiley & Sons; 3. Birge, J. R., & Louveaux, F. (2011). Introduction to stochastic programming (Springer series in operations research and financial engineering). Course URL http://www.bus.ed.ac.uk/programmes/ugpc.html"
"Mergers, Acquisitions, and Corporate Restructuring",BUST10149,University of Edinburgh,United Kingdom,https://www.drps.ed.ac.uk/25-26/dpt/cxbust10149.htm,2025/26,Semester 1,winter,Undergraduate,20,SCQF credits,10.0,"The Mergers, Acquisitions, and Corporate Restructuring course will provide you with the necessary skills to understand the strategic potential and limitations of Mergers, Acquisitions, and Corporate Restructuring activities such as divestitures, their value creation potential, as well as the role of markets and institutions within the same framework. The course is designed to provide you with the necessary grounding in theory, as well as applied and organizational skills, to demonstrate that you will be successful in related career paths.","The course aims to deliver the most important issues on Mergers, Acquisitions, and Corporate Restructuring such as corporate divestitures. In particular, the course aims to develop your ability to critically understand and evaluate issues such as: - Mergers, Acquisitions, and Corporate Restructuring activities, the role of the business cycle in the economy and also the stock market development, in causing Mergers, Acquisitions, and Corporate Restructuring activities. - Regulatory and strategic considerations, takeover tactics, and takeover defences. - Motives for Mergers, Acquisitions, and Corporate Restructuring. - Target firm and foreign target firm valuation. - Issues developed through information economics that contribute on the negotiation and re-negotiation stage of corporate reforms such as M&As and divestitures. - Empirical tests on the performance of merging and divesting firms at both the announcement- and the post-merger or integration period. - Cross-border (cross-industry) acquisitions and their main differences with domestic (focused) ones. The course relies on knowledge acquired from the Introduction to Corporate Finance or Principles of Finance courses in year 2 and covers the most recent developments from theoretical and empirical perspectives of Mergers, Acquisitions, and Corporate Restructuring. Outline Content The course will cover the following over ten two-hour sessions - Introduction and overview of Mergers, Acquisitions, and Corporate Restructuring Activities, waves, and their theoretical perspectives. - Mergers, Acquisitions, and Divestitures strategies - Motives, implications, and alternative perspectives. - Target (foreign target) and divesting firm valuation. - Valuation of synergies. - Structuring corporate reforms and negotiations - Paying for the target firm & the investment banker perspectives. - Value creation from M&As and Divestitures - Methods and evidence. Student Learning Experience You will have to read the core textbooks that will support the learning outcomes of each topic/lecture, and also most of the additional references/readings that will accompany each topic. The weekly lectures will explore particular aspects of the course and the additional readings will attempt to help you put material in context, which will not substitute the core reading. During lectures you will be asked to be active, completing exercises and discussing issues with your fellow students. In any case, the nature of the material means that in most cases there is not a single acceptable answer. The important aspect is that you are able to argue on a case and present compelling evidence to back your argument.","On completion of this course, the student will be able to: Critically understand the principal theories, concepts and principles of Mergers, Acquisitions, and Corporate Restructuring. Show detailed knowledge and understanding on, and also critically challenge, the valuation principles, the assumptions, as well as the practices of Mergers, Acquisitions, and Corporate Restructuring. Demonstrate detailed knowledge on target (and foreign target) valuation, as well as on the estimation of the synergies arising from Mergers, Acquisitions, and Corporate Restructuring. Demonstrate detailed knowledge (and ability to critically discuss) the various methodologies aiming to quantify value creation from Mergers, Acquisitions, and Corporate Restructuring, as well as critically discuss the literature on factors related to value creation from such corporate activities and rationalise success potential. Critically review and consolidate knowledge, skills, practices and thinking of the ways in which the negotiation of the various terms of Mergers, Acquisitions, and Corporate Restructuring is developed and structured.","Written Exam 50 %, Coursework 50 %, Practical Exam 0 %","Required: DePamphilis, D., 2019. Mergers, Acquisitions, and Other Restructuring Activities, 9th Edition. Academic Press. Recommended: Sudarsanam, S. 2010. Creating Value from Mergers and Acquisitions: The Challenges, Prentice Hall - Pearson. Arzac, R.E., 2008. Valuation for Mergers, Buyouts and Restructuring, Wiley. (Important for topics 3 to 6). Additional readings (academic papers) will be suggested in the course of the lectures."
Operations Strategy,BUST10092,University of Edinburgh,United Kingdom,https://www.drps.ed.ac.uk/25-26/dpt/cxbust10092.htm,2025/26,Semester 2,summer,Undergraduate,20,SCQF credits,10.0,This course provides students with an understanding of the content of organisation's operations strategy and the processes by which they are developed and implemented.,"The course is divided into six blocks: Introduction to Operations Strategy, Information Technology Strategy, Logistics Strategy, Quality Strategy, the Development & Implementation of Operations Strategy. Syllabus Lecture 1 - Introduction Lecture 2 - Lean Lecture 3 - Information Technology Strategy Lecture 4 - Supply Chain Management Strategies Lecture 5 - Strategic Procurement Partnerships Lecture 6 - Business Process Outsourcing Lecture 7 - Operational Risk Lecture 8 - Development of Operations Strategies Lecture 9 - Implementation of Operations Strategies Lecture 10 - Course Overview and Report Presentations Student Learning Experience The course will be taught as ten two-hour sessions. The lectures will address the wide range of topics involved in operations management from a strategic perspective. The course will relate the development and implementation of Operations Strategy with current debates in management theory and practice. The course-work project and associated presentations will provide an opportunity for students to analyse and discuss the issues in a case study of their own choice.","On completion of this course, the student will be able to: Describe and discuss the key operations strategy concepts covered. Discuss critically the practical use of the techniques covered, taking into account organisational context. Explain and discuss the relationship between operations strategy with other functional strategies and overall business policy in the context of the strategic goals and objectives of the organisation. Relate theoretical debates about the choices available to operations managers to the practical development and implementation of operations strategy. Learning Resources Course resources will be linked from Learn. Students are expected, and advised, to keep up-to-date with suggested readings. Additional Information","Written Exam 50 %, Coursework 50 %, Practical Exam 0 %",
