course_title,course_code,university,country,source_url,academic_year,semester,semester_normalized,study_level,credits,credit_system,ects_credits,aims,course_content,learning_outcomes,assessment_methods,literature
Theories and Techniques of Persuasion,BUST10151,University of Edinburgh,United Kingdom,https://www.drps.ed.ac.uk/25-26/dpt/cxbust10151.htm,2025/26,Semester 1,winter,Undergraduate,20,SCQF credits,10.0,"Why does language persuade us to act? How do audiences think? What is persuasion? Students taking this course will consider seminal responses to these and related questions. Their overall goal will be to learn - through theories, examples and practice - the stakes involved in becoming competent persuaders.","We will study theories and techniques of persuasion in order to develop our own persuasive capacities. This means that we will study persuasion as a craft learned through exemplars and by means of practice. For our theories, we look towards philosophical accounts of rhetoric. For our techniques, we looks towards psychological models. For our practice, we produce copy. We begin with a consideration of rhetorical situations: what they are and how we should negotiate them. This first half of the course brings us into contact with old ideas that remain applicable, as we shall see, to contemporary situations. We pay special attention here to the enduring critique of rhetoric, as developed by Plato, as well as to the alternative representation of rhetoric as a craft that we have inherited from Aristotle. With these foundations set by means of old theories and recent examples, we then proceed, in the second half of the course, towards a consideration of the challenges that define the application of psychological insights to the craft of persuasion. Outline Content PART ONE: Theories of Persuasion 1. Introduction- The Advantages and Disadvantages of Persuasion Today 2. Persuasion as Deception- The Endurance of the Platonic Critique I 3. Persuasion as Manipulation- The Endurance of the Platonic Critique II 4. Persuasion in Public Life I- Aristotle, with and Against Plato 5. Persuasion in Public Life II- Machiavelli, with and Against Aristotle PART TWO: Techniques of Persuasion 6. Psychoanalytic Persuasion- Affecting the Unconscious, Producing Propaganda 7. Cognitive Persuasion- Mapping the Decision, Measuring the Process 8. Communicative Persuasion- Changing the Frame, Flattering the Audience 9. Behavioural Persuasion- Managing the Platform, Automating the Context 10. Conclusion- The Advantages and Disadvantages of Persuasion Today II Student Learning Experience Students will be required to undertake a series of assigned listening, watching and reading tasks in advance of each session. Each week will be composed of a one-hour lecture and a one-hour workshop. Within each of the first five workshops, students will work in their teams with a series of practical assignments that will enable them to prepare their video assignment. Formative feedback will be provided within each of these sessions. Within each of the final five workshops, students will work in groups with a series of practical assignments that will enable them to work on their essays. Formative feedback will again be provided within each of these sessions.","On completion of this course, the student will be able to: Appreciate the practical value of various philosophical and psychological accounts of persuasion Both Assessments Produce persuasive copy Group Assessment Analyse rhetorical situations both as such and through examples Both Assessments Distinguish persuasion from decepetion and description both as such and through examples Individual Assessment Critically assess the persuasiveness of contemporary communication campaigns Both Assessments","Written Exam 0 %, Coursework 100 %, Practical Exam 0 %","A reading pack/list of core texts will be prepared for each lecture in accordance with the authors and themes named in the above course outline. This will be comprised of primary texts, academic articles, trade publications and practical examples. Students will not be expected to read a core text in addition to these but supplementary general texts such as the following will be recommended: Michael J MacDonald (ed.) The Oxford Handbook of Rhetorical Studies George Kennedy A New History of Classical Rhetoric Sam Leith You TalkinÂ¿ to Me? Rhetoric from Aristotle to Obama Richard Toye Rhetoric: A Very Short Introduction Jason Stanley How Propaganda Works"
"Development, Inequality and Trade",ECNM08024,University of Edinburgh,United Kingdom,https://www.drps.ed.ac.uk/25-26/dpt/cxecnm08024.htm,2025/26,Semester 1,winter,Undergraduate,20,SCQF credits,10.0,"This course intends to illustrate the usefulness of economic analysis in a global context. The course is divided into 3 main themes: development economics, inequality and trade. The first part of the course studies how international trade generates gains and inequalities. The second part of the course focuses on developing countries and relevant principles of economic development.","This course is designed to provide an understanding of the key determinants of economic development, inequality and trade. The course combines economic theories with empirical studies. It is divided into two halves. In the first half, we study how the economic development of different regions is interconnected through trade. We begin by examining the patterns of international trade. We then define and use the principle of comparative advantage. We formalise the reasons why countries trade using classical theories and general equilibrium models of trade. These models highlight that trade can generate both gains and inequalities. In the second half, we begin by defining economic development and measuring the gap between poor and rich countries. We will define and make use of concepts like poverty, inequality and economic growth. We then review the classic theories of economic growth, which attempt to explain why some countries are rich and others are poor and contrast those with the contemporary models of development. We will also consider the role of political institutions and human capital in generating economic development.","On completion of this course, the student will be able to: A knowledge and understanding of principles and models used in the study of development economics, inequality and trade. Research and investigative skills such as problem framing and solving and the ability to assemble and evaluate complex evidence and arguments. Communication skills in order to critique, create and communicate understanding. Personal effectiveness through task-management, time-management, dealing with uncertainty and adapting to new situations, personal and intellectual autonomy through independent learning. Practical/technical skills such as, modelling skills (abstraction, logic, succinctness), qualitative and quantitative analysis and general IT literacy.","Written Exam 80 %, Coursework 20 %, Practical Exam 0 %",None
Economic Applications,ECNM08003,University of Edinburgh,United Kingdom,https://www.drps.ed.ac.uk/25-26/dpt/cxecnm08003.htm,2025/26,Semester 2,summer,Undergraduate,20,SCQF credits,10.0,"The course is intended to illustrate the usefulness of basic economic principles in a varied range of, primarily applied, contexts. An understanding of basic economic principles at the level of: Mankiw and Taylor 'Economics' is presumed. The course is primarily aimed at students who want to obtain a broad but basic insight into applications of economics to contemporary economic issues, but do not intend (or do not want to keep open the option) to progress to further study of economics in their 2nd year. Students who do plan (or want to keep open the option) to progress to Economics 2 should take Economics 1.","The course is intended to illustrate the usefulness of basic economic principles in a varied range of, primarily applied, contexts. The contexts covered will vary from year to year. A typical year might include contexts drawn from: international economics; business cycles; game theory and behavioural economics; and information economics. The course is taught through a programme of lectures and tutorials. The course relies primarily on words, diagrams and numerical illustrations. The use of formal mathematics is limited and basic. Reading material for the course will be drawn from a variety of sources. An understanding of basic economic principles at the level of: Mankiw and Taylor 'Economics' is presumed. The course is primarily aimed at students who want to obtain a broad but basic insight into applications of economics to contemporary economic issues, but do not intend (or do not want to keep open the option) to progress to further study of economics in their 2nd year. Students who do plan (or want to keep open the option) to progress to Economics 2 should take Economics 1.","On completion of this course, the student will be able to: A knowledge and understanding of key economic and social issues, through application of basic economic principles. Research and investigative skills such as problem framing and solving and the ability to assemble and evaluate complex evidence and arguments. Communication skills in order to critique, create and communicate understanding and to collaborate with and relate to others. Personal effectiveness through task-management, time-management, teamwork and group interaction, dealing with uncertainty and adapting to new situations, personal and intellectual autonomy through independent learning. Practical/technical skills such as, modelling skills (abstraction, logic, succinctness), qualitative and quantitative analysis and general IT literacy.","Written Exam 75 %, Coursework 25 %, Practical Exam 0 %",Mankiw and Taylor 'Economics'
Economic Principles,ECNM08004,University of Edinburgh,United Kingdom,https://www.drps.ed.ac.uk/25-26/dpt/cxecnm08004.htm,2025/26,Semester 1,winter,Undergraduate,20,SCQF credits,10.0,"The course is intended to provide a broad introduction to the basic principles of economic analysis. The course is primarily aimed at students who want to obtain a broad but basic insight into economics, but do not intend (or do not want to keep open the option) to progress to further study of economics in their 2nd year. Students who do plan (or want to keep open the option) to progress to Economics 2 should take Economics 1.","The course is intended to provide a broad introduction to the principles of microeconomic and macroeconomic analysis. Course content varies from year to year, but would typically address the microeconomic analysis of the behaviour of individuals and firms, the operation of markets, and government intervention in markets through taxes and regulation; and the macroeconomic analysis of the behaviour of economy-wide measures such as output, unemployment, money, interest rates, and inflation. The course is taught through a programme of lectures and tutorials. The course relies primarily on words, diagrams and numerical illustrations. The use of formal mathematics is limited and basic. The recommended textbook is: The recommended textbook is: Mankiw and Taylor 'Economics', latest edition. The course is primarily aimed at students who want to obtain a broad but basic insight into economics, but do not intend (or do not want to keep open the option) to progress to further study of economics in their 2nd year. Students who do plan (or want to keep open the option) to progress to Economics 2 should take Economics 1. Please note: the Group Project assessment includes attendance of a poster presentation, which will take place on a Saturday towards the end of the semester. Attendance at this session is required.","On completion of this course, the student will be able to: A knowledge and understanding of microeconomics and macroeconomic principles, and of economic issues through application of these principles. Research and investigative skills such as problem framing and solving and the ability to assemble and evaluate complex evidence and arguments. Communication skills in order to critique, create and communicate understanding and to collaborate with and relate to others. Personal effectiveness through task-management, time-management, teamwork and group interaction, dealing with uncertainty and adapting to new situations, personal and intellectual autonomy through independent learning. Practical/technical skills such as, modelling skills (abstraction, logic, succinctness), qualitative and quantitative analysis and general IT literacy.","Written Exam 75 %, Coursework 25 %, Practical Exam 0 %",Mankiw and Taylor 'Economics'
Economics 1,ECNM08013,University of Edinburgh,United Kingdom,https://www.drps.ed.ac.uk/25-26/dpt/cxecnm08013.htm,2025/26,Full Year,full_year,Undergraduate,40,SCQF credits,20.0,"This calculus-based course is intended to develop a rigorous understanding of core economic models and analysis, together with an ability to apply the analysis in a variety of contexts. The course is primarily aimed at students who intend (or want to keep open the option) to progress to further study of economics in their 2nd year. Other students are welcome, but may find Economic Principles and Applications a more suitable alternative.","This calculus-based course is intended to develop a rigorous understanding of core economic models and analysis, together with an ability to apply the analysis in a variety of contexts. The first semester focuses on developing and using models of supply and demand in microeconomic (individual market) contexts. The second semester looks at the theory of the firm and market structure, factor markets, externalities, the role of government and general equilibrium, with applications to monopoly and oligopoly, stock markets, property rights and public goods. Relevant mathematical techniques (e.g: Linear Equations & Their Graphs; Solving systems of equations; Derivatives and Differentiation; Optimisation; Functions of Two or More Variables; Basic Probability; Elasticity; Exponential and Logarithmic Functions; Compound & Continuous Growth; Calculus of Growth.) are developed and applied to economic contexts as an integral part of the course. The course is taught through a programme of lectures and tutorials. Learning-by-doing, through problem solving, is an important ingredient of the course, as part of an active approach to learning. The course is primarily aimed at students who intend (or want to keep open the option) to progress to further study of economics in their 2nd year. Other students are welcome, but may find Economic Principles and/or Economic Applications a more suitable alternative.","On completion of this course, the student will be able to: A knowledge and understanding of economic analysis including principles, models and associated mathematical and statistical techniques, along with applications and policy implications of those models. Research and investigative skills such as problem framing and solving and the ability to assemble and evaluate complex evidence and arguments. Communication skills in order to critique, create and communicate understanding. Personal effectiveness through task-management, time-management, dealing with uncertainty and adapting to new situations, personal and intellectual autonomy through independent learning. Practical/technical skills such as, modelling skills (abstraction, logic, succinctness), qualitative and quantitative analysis and general IT literacy.","Written Exam 90 %, Coursework 10 %, Practical Exam 0 %","Required textbooks - Frank & Cartwright, Microeconomics and Behaviour (3rd edition) Suggested textbook (for maths) - Renshaw, Maths for Economics (5th edition)"
Economics 1 (VS1),ECNM08014,University of Edinburgh,United Kingdom,https://www.drps.ed.ac.uk/25-26/dpt/cxecnm08014.htm,2025/26,Semester 1,winter,Undergraduate,20,SCQF credits,10.0,"This calculus-based course is intended to develop a rigorous understanding of core economic models and analysis, together with an ability to apply the analysis in a variety of contexts. It focuses on developing and using models of supply and demand in microeconomic (individual market) contexts. Students who have not previously studied economics may find it useful to take Economic Principles VV1 alongside Economics 1 VS1.","This calculus-based course is intended to develop a rigorous understanding of core economic models and analysis, together with an ability to apply the analysis in a variety of contexts. It focuses on developing and using models of supply and demand in microeconomic (individual market) contexts. Relevant mathematical techniques (e.g: Linear Equations & Their Graphs; Solving systems of equations; Derivatives and Differentiation; Optimisation; Functions of Two or More Variables; Basic Probability; Elasticity; Exponential and Logarithmic Functions; Compound & Continuous Growth; Calculus of Growth.) are developed and applied to economic contexts as an integral part of the course. The course is taught through a programme of lectures and tutorials. Learning-by-doing, through problem solving, is an important ingredient of the course, as part of an active approach to learning.","On completion of this course, the student will be able to: A knowledge and understanding of economic analysis including principles, models and associated mathematical and statistical techniques, along with applications and policy implications of those models. Research and investigative skills such as problem framing and solving and the ability to assemble and evaluate complex evidence and arguments. Communication skills in order to critique, create and communicate understanding. Personal effectiveness through task-management, time-management, dealing with uncertainty and adapting to new situations, personal and intellectual autonomy through independent learning. Practical/technical skills such as, modelling skills (abstraction, logic, succinctness), qualitative and quantitative analysis and general IT literacy.","Written Exam 90 %, Coursework 10 %, Practical Exam 0 %","Required textbooks - Frank & Cartwright, Microeconomics and Behaviour (2nd edition) Suggested textbook (for maths) - Renshaw, Maths for Economics (currently in 3rd edition, but any edition will do)"
Economics 2,ECNM08006,University of Edinburgh,United Kingdom,https://www.drps.ed.ac.uk/25-26/dpt/cxecnm08006.htm,2025/26,Full Year,full_year,Undergraduate,40,SCQF credits,20.0,"This intermediate level course is intended to develop a rigorous understanding of core economic models and analysis, together with an ability to apply the analysis in a variety of contexts. It is a required course for students intending to proceed to an Honours degree involving Economics.","This course is intended to develop a rigorous understanding of core economic models and analysis, together with an ability to apply the analysis in a variety of contexts. In the first semester we consider macroeconomic (aggregate, economy-wide) phenomena. We look in greater depth at national income accounting, economic growth, money and inflation; labour markets and unemployment and consider relevant mathematical techniques. The second semester looks at macroeconomics and includes topics such as monetary and fiscal policy, the open economy, exchange rate systems and monetary union, business cycles, economic policy and financial markets. The course is taught through a programme of lectures and tutorials. Learning-by-doing, through problem solving and tutorial work, is an important ingredient of the course, with regular practice tests to reinforce an active approach to learning. Students with a weak maths background will need to be prepared to work at developing their maths skills. A passing course mark is an overall mark of 40% or higher. However, candidates must also pass the final examination with a mark of 40% or above in order to pass the course. Failure to do so will result in a forced fail (FF) regardless of the candidate's coursework mark.","On completion of this course, the student will be able to: A knowledge and understanding of economic analysis, including principles, models and associated mathematical techniques, along with applications and policy implications of those models. Research and investigative skills such as problem framing and solving and the ability to assemble and evaluate complex evidence and arguments. Communication skills in order to critique, create and communicate understanding. Personal effectiveness through task-management, time-management, dealing with uncertainty and adapting to new situations, personal and intellectual autonomy through independent learning. Practical/technical skills such as, modelling skills (abstraction, logic, succinctness), qualitative and quantitative analysis.","Written Exam 75 %, Coursework 25 %, Practical Exam 0 %","Required textbooks - Gottfries, Macroeconomics (1st edition) Suggested textbook (for maths) - Renshaw, Maths for Economics (currently in 3rd edition, but any edition will do)"
Economics 2 (VS1),ECNM08011,University of Edinburgh,United Kingdom,https://www.drps.ed.ac.uk/25-26/dpt/cxecnm08011.htm,2025/26,Semester 1,winter,Undergraduate,20,SCQF credits,10.0,"This intermediate level course is intended to develop a rigorous understanding of core economic models and analysis, together with an ability to apply the analysis in a variety of contexts.","This course is intended to develop a rigorous understanding of core economic models and analysis, together with an ability to apply the analysis in a variety of contexts. It looks at the theory of the firm and market structure, factor markets, externalities, the role of government and general equilibrium, with applications to monopoly and oligopoly, stock markets, property rights and public goods. Along with two economics lectures each week, a third lecture will focus on mathematical techniques including constrained optimisation. The course is taught through a programme of lectures and tutorials. Learning-by-doing, through problem solving and tutorial work, is an important ingredient of the course, with regular practice tests to reinforce an active approach to learning. Students with a weak maths background will need to be prepared to work at developing their maths skills.","On completion of this course, the student will be able to: A broad knowledge and understanding of microeconomic analysis, including principles, models and associated mathematical and statistical techniques, along with applications and policy implications of those models. Research and investigative skills such as problem framing and solving and the ability to assemble and evaluate complex evidence and arguments. Communication skills in order to critique, create and communicate understanding. Personal effectiveness through task-management, time-management, dealing with uncertainty and adapting to new situations, personal and intellectual autonomy through independent learning. Practical/technical skills such as, modelling skills (abstraction, logic, succinctness), qualitative and quantitative analysis and general IT literacy","Written Exam 95 %, Coursework 5 %, Practical Exam 0 %","Suggested textbook (for maths) - Renshaw, Maths for Economics (currently in 3rd edition, but any edition will do)"
